{
  "schema_version": "1.0",
  "engine_version": "0.1.0",
  "mode": "rules",
  "readiness": 0,
  "readiness_is_probability": false,
  "failure_probability": null,
  "findings": [
    {
      "id": "DATA001",
      "category": "data",
      "severity": "critical",
      "evidence": "Matched risk vocabulary: migration",
      "impact": "Persistent data may be changed irreversibly",
      "checks": [
        "Verify backup restoration and migration dry run"
      ],
      "repairs": [
        "Prepare and test a rollback or restore procedure"
      ],
      "requires_approval": true,
      "certainty": "signal",
      "occurrences": 1
    },
    {
      "id": "NET001",
      "category": "network",
      "severity": "medium",
      "evidence": "Matched risk vocabulary: Fetch",
      "impact": "External dependency may time out or change",
      "checks": [
        "Check timeout, bounded retry and pinned content"
      ],
      "repairs": [
        "Cache verified inputs and specify retry limits"
      ],
      "requires_approval": false,
      "certainty": "signal",
      "occurrences": 1
    },
    {
      "id": "DEPLOY001",
      "category": "deployment",
      "severity": "critical",
      "evidence": "Matched risk vocabulary: Deploy",
      "impact": "Live service may be disrupted",
      "checks": [
        "Verify target, staged validation and rollback"
      ],
      "repairs": [
        "Require approval and tested rollback before execution"
      ],
      "requires_approval": true,
      "certainty": "signal",
      "occurrences": 1
    },
    {
      "id": "GIT001",
      "category": "file",
      "severity": "high",
      "evidence": "Git workspace has uncommitted changes",
      "impact": "Task may fail or exceed its intended boundary",
      "checks": [
        "Inspect local diff before writes"
      ],
      "repairs": [
        "Preserve or commit existing work"
      ],
      "requires_approval": false,
      "certainty": "confirmed",
      "occurrences": 1
    },
    {
      "id": "SAFE001",
      "category": "data",
      "severity": "critical",
      "evidence": "Dangerous step lacks declared reversibility and rollback",
      "impact": "Task may fail or exceed its intended boundary",
      "checks": [
        "Verify restoration independently"
      ],
      "repairs": [
        "Prepare a verified rollback before approval"
      ],
      "requires_approval": true,
      "certainty": "signal",
      "occurrences": 1
    },
    {
      "id": "SAFE002",
      "category": "data",
      "severity": "critical",
      "evidence": "Data mutation lacks a declared backup",
      "impact": "Task may fail or exceed its intended boundary",
      "checks": [
        "Test backup restoration"
      ],
      "repairs": [
        "Create and verify backup before execution"
      ],
      "requires_approval": true,
      "certainty": "signal",
      "occurrences": 1
    },
    {
      "id": "NET002",
      "category": "network",
      "severity": "medium",
      "evidence": "Network step lacks declared timeout or bounded retries",
      "impact": "Task may fail or exceed its intended boundary",
      "checks": [
        "Inspect request policy"
      ],
      "repairs": [
        "Declare and enforce timeout and retry bounds"
      ],
      "requires_approval": false,
      "certainty": "signal",
      "occurrences": 1
    }
  ],
  "checks": [
    {
      "kind": "git",
      "status": "dirty"
    },
    {
      "kind": "config",
      "name": "pyproject.toml",
      "valid": true
    },
    {
      "kind": "tool",
      "available": true
    },
    {
      "kind": "path",
      "available": true
    }
  ],
  "graph": {
    "nodes": [
      "inspect",
      "migrate",
      "verify"
    ],
    "edges": [
      {
        "from": "inspect",
        "to": "migrate"
      },
      {
        "from": "migrate",
        "to": "verify"
      }
    ],
    "topological_order": [
      "inspect",
      "migrate",
      "verify"
    ],
    "cyclic": false,
    "findings": []
  },
  "limitations": [
    "Static signals are incomplete; declarations are not proof of safety.",
    "No network, project scripts or planned commands were executed."
  ]
}
